{
  "$schema": "../../../schemas/fixtures/pathway1/target.schema.json",
  "research_boundary": "Research use only. Not for diagnosis, treatment, cure claims, prescribing, clinical deployment, regulatory compliance, or drug-safety certification.",
  "target_id": "uniprot:Q12809",
  "gene_symbol": "KCNH2",
  "protein_name": "Potassium voltage-gated channel subfamily H member 2 (hERG / Kv11.1)",
  "disease_associations": [
    "EFO:0004143",
    "EFO:0000238",
    "Orphanet:768"
  ],
  "genetic_evidence_score": 0.91,
  "druggability_score": 0.87,
  "novelty_flag": false,
  "structure_refs": [
    "pdb:7CN1",
    "pdb:5VA1"
  ],
  "source_manifest_refs": [
    "OpenTargets_v25_06",
    "TTD_2026",
    "GWAS_Catalog_EBI",
    "ChEMBL_36",
    "UniProt_SwissProt"
  ],
  "kg_gene_node_ref": "gene:KCNH2",
  "evidence_pillars": {
    "genetic_evidence_score": 0.91,
    "literature_hit_count": 4821,
    "pocket_volume_angstrom3": 1250.0,
    "ttd_entry_present": true
  },
  "stub_provenance_note": "Values are stub canned outputs drawn from Open Targets v25.06, TTD 2026, GWAS Catalog, ChEMBL 36, and UniProt Swiss-Prot; real API integration pending cutover."
}
