{
  "$schema": "../../../schemas/fixtures/pathway1/target.schema.json",
  "research_boundary": "Research use only. Not for diagnosis, treatment, cure claims, prescribing, clinical deployment, regulatory compliance, or drug-safety certification.",
  "target_id": "uniprot:Q14524",
  "gene_symbol": "SCN5A",
  "protein_name": "Sodium channel protein type 5 subunit alpha (Nav1.5)",
  "disease_associations": [
    "EFO:0004143",
    "EFO:0000378",
    "Orphanet:101016"
  ],
  "genetic_evidence_score": 0.88,
  "druggability_score": 0.79,
  "novelty_flag": false,
  "structure_refs": [
    "pdb:7DTC",
    "pdb:6LQA"
  ],
  "source_manifest_refs": [
    "OpenTargets_v25_06",
    "TTD_2026",
    "GWAS_Catalog_EBI",
    "ChEMBL_36",
    "UniProt_SwissProt"
  ],
  "kg_gene_node_ref": "gene:SCN5A",
  "evidence_pillars": {
    "genetic_evidence_score": 0.88,
    "literature_hit_count": 3217,
    "pocket_volume_angstrom3": 1640.0,
    "ttd_entry_present": true
  },
  "stub_provenance_note": "Values are stub canned outputs drawn from Open Targets v25.06, TTD 2026, GWAS Catalog, ChEMBL 36, and UniProt Swiss-Prot; real API integration pending cutover."
}
