{
  "$schema": "../../../schemas/fixtures/pathway1/target.schema.json",
  "research_boundary": "Research use only. Not for diagnosis, treatment, cure claims, prescribing, clinical deployment, regulatory compliance, or drug-safety certification.",
  "target_id": "uniprot:P51787",
  "gene_symbol": "KCNQ1",
  "protein_name": "Potassium voltage-gated channel subfamily KQT member 1 (Kv7.1)",
  "disease_associations": [
    "EFO:0000238",
    "Orphanet:101016",
    "EFO:0004143"
  ],
  "genetic_evidence_score": 0.85,
  "druggability_score": 0.68,
  "novelty_flag": false,
  "structure_refs": [
    "pdb:6V01",
    "pdb:5VMS"
  ],
  "source_manifest_refs": [
    "OpenTargets_v25_06",
    "TTD_2026",
    "GWAS_Catalog_EBI",
    "ChEMBL_36",
    "UniProt_SwissProt"
  ],
  "kg_gene_node_ref": "gene:KCNQ1",
  "evidence_pillars": {
    "genetic_evidence_score": 0.85,
    "literature_hit_count": 2943,
    "pocket_volume_angstrom3": 980.0,
    "ttd_entry_present": true
  },
  "stub_provenance_note": "Values are stub canned outputs drawn from Open Targets v25.06, TTD 2026, GWAS Catalog, ChEMBL 36, and UniProt Swiss-Prot; real API integration pending cutover."
}
